{
  "schemaVersion": 1,
  "families": [
    "deep-corridor",
    "rare-prefix",
    "combination-lock",
    "novelty-honeypot",
    "false-novelty",
    "delayed-consequence",
    "order-dependent",
    "compound-needle"
  ],
  "algorithms": ["random", "systematic", "coverage", "swarm", "inkcheck"],
  "fixtureSeeds": [101],
  "searchSeeds": [101, 102, 103],
  "budgets": [1200000],
  "budgetMode": "wall-time",
  "workBudgetCeiling": 100000000,
  "difficulty": 10,
  "storySeed": 1,
  "inkcheckOptions": {
    "search": "portfolio",
    "minRepro": false,
    "maxDepth": 1000,
    "concurrency": 1
  },
  "resources": {
    "maxMemoryMb": 4096,
    "progressIntervalTransitions": 10000,
    "progressIntervalMs": 1000
  }
}
